<?xml version="1.0" encoding="UTF-8"?>
<SERF xmlns="http://gcmd.gsfc.nasa.gov/Aboutus/xml/serf/" xmlns:serf="http://gcmd.gsfc.nasa.gov/Aboutus/xml/serf/" xmlns:xsi="http://www.w3.org/2001/XMLSchema-instance" xsi:schemaLocation="http://gcmd.gsfc.nasa.gov/Aboutus/xml/serf/ http://gcmd.gsfc.nasa.gov/Aboutus/xml/serf/serf_v9.9.3.xsd">
  <Entry_ID>NASA_GES_DISC_AIRS_Atmosphere_Data_Web_Coverage_Service</Entry_ID>
  <Entry_Title>OGC Web Coverage Service (WCS) for accessing Atmospheric Infrared Sounder (AIRS) Data</Entry_Title>
  <Service_Citation>
    <Originators>NASA Goddard Earth Sciences (GES) Data and Information Services Center (DISC)</Originators>
    <Title>OGC Web Coverage Service (WCS) for accessing Atmospheric Infrared Sounder (AIRS) Data</Title>
  </Service_Citation>
  <Personnel>
    <Role>TECHNICAL CONTACT</Role>
    <Role>SERF AUTHOR</Role>
    <First_Name>FIRSTNAME</First_Name>
    <Last_Name>LASTNAME</Last_Name>
    <Email>FIRSTNAME.LASTNAME@nasa.gov</Email>
    <Phone>301-555-5555</Phone>
    <Phone>301-777-5555</Phone>
    <Fax>301-555-5678</Fax>
    <Contact_Address>
      <Address>NASA/GSFC Code 610.2</Address>
      <City>Greenbelt</City>
      <Province_or_State>Maryland</Province_or_State>
      <Postal_Code>20771</Postal_Code>
      <Country>USA</Country>
    </Contact_Address>
  </Personnel>
  <Service_Parameters uuid="617a50aa-5762-4ff3-aa03-c94b5cc65209">
    <Service_Category>EARTH SCIENCE SERVICES</Service_Category>
    <Service_Topic>WEB SERVICES</Service_Topic>
    <Service_Term>DATA APPLICATION SERVICES</Service_Term>
    <Service_Specific_Name>GEOGRAPHIC DATA EXTRACTION SERVICES</Service_Specific_Name>
  </Service_Parameters>
  <Service_Parameters uuid="62d7c667-997a-4a9d-abe1-4cca4519673e">
    <Service_Category>EARTH SCIENCE SERVICES</Service_Category>
    <Service_Topic>WEB SERVICES</Service_Topic>
    <Service_Term>DATA APPLICATION SERVICES</Service_Term>
    <Service_Specific_Name>COVERAGE GENERALIZATION SERVICES</Service_Specific_Name>
  </Service_Parameters>
  <Service_Parameters uuid="91e02d43-bf56-480f-89c9-ddfca7fc7239">
    <Service_Category>EARTH SCIENCE SERVICES</Service_Category>
    <Service_Topic>WEB SERVICES</Service_Topic>
    <Service_Term>DATA PROCESSING SERVICES</Service_Term>
    <Service_Specific_Name>COVERAGE GENERALIZATION SERVICES</Service_Specific_Name>
  </Service_Parameters>
  <Service_Parameters uuid="d6379bf5-88dd-4ec0-9b15-441db5b10b59">
    <Service_Category>EARTH SCIENCE SERVICES</Service_Category>
    <Service_Topic>WEB SERVICES</Service_Topic>
    <Service_Term>INFORMATION MANAGEMENT SERVICES</Service_Term>
    <Service_Specific_Name>WEB COVERAGE SERVICE</Service_Specific_Name>
  </Service_Parameters>
  <Science_Parameters uuid="2e5a401b-1507-4f57-82b8-36557c13b154">
    <Science_Category>EARTH SCIENCE</Science_Category>
    <Science_Topic>ATMOSPHERE</Science_Topic>
    <Science_Term>AEROSOLS</Science_Term>
  </Science_Parameters>
  <Science_Parameters uuid="77397026-09c9-44e0-b85f-77b2bc9b1630">
    <Science_Category>EARTH SCIENCE</Science_Category>
    <Science_Topic>ATMOSPHERE</Science_Topic>
    <Science_Term>AIR QUALITY</Science_Term>
  </Science_Parameters>
  <Science_Parameters uuid="b9c56939-c624-467d-b196-e56a5b660334">
    <Science_Category>EARTH SCIENCE</Science_Category>
    <Science_Topic>ATMOSPHERE</Science_Topic>
    <Science_Term>ATMOSPHERIC CHEMISTRY</Science_Term>
  </Science_Parameters>
  <Science_Parameters uuid="35e1f93b-99b3-4430-b477-0ecafa80d67a">
    <Science_Category>EARTH SCIENCE</Science_Category>
    <Science_Topic>ATMOSPHERE</Science_Topic>
    <Science_Term>ATMOSPHERIC TEMPERATURE</Science_Term>
  </Science_Parameters>
  <Science_Parameters uuid="286d2ae0-9d86-4ef0-a2b4-014843a98532">
    <Science_Category>EARTH SCIENCE</Science_Category>
    <Science_Topic>ATMOSPHERE</Science_Topic>
    <Science_Term>ATMOSPHERIC WATER VAPOR</Science_Term>
  </Science_Parameters>
  <Science_Parameters uuid="df160e31-ae45-41a4-9093-a80fe5303cea">
    <Science_Category>EARTH SCIENCE</Science_Category>
    <Science_Topic>ATMOSPHERE</Science_Topic>
    <Science_Term>ATMOSPHERIC WINDS</Science_Term>
  </Science_Parameters>
  <Science_Parameters uuid="162e2243-3266-4999-b352-d8a1a9dc82ac">
    <Science_Category>EARTH SCIENCE</Science_Category>
    <Science_Topic>ATMOSPHERE</Science_Topic>
    <Science_Term>CLOUDS</Science_Term>
  </Science_Parameters>
  <Science_Parameters uuid="1532e590-a62d-46e3-8d03-2351bc48166a">
    <Science_Category>EARTH SCIENCE</Science_Category>
    <Science_Topic>ATMOSPHERE</Science_Topic>
    <Science_Term>PRECIPITATION</Science_Term>
  </Science_Parameters>
  <Science_Parameters uuid="4ad0c52d-6449-48ff-8678-adc6b2cebcb7">
    <Science_Category>EARTH SCIENCE</Science_Category>
    <Science_Topic>ATMOSPHERE</Science_Topic>
    <Science_Term>ATMOSPHERIC RADIATION</Science_Term>
  </Science_Parameters>
  <Science_Parameters uuid="08fd82a1-4370-46a2-82ea-94c0f91498a7">
    <Science_Category>EARTH SCIENCE</Science_Category>
    <Science_Topic>ATMOSPHERE</Science_Topic>
    <Science_Term>ATMOSPHERIC PRESSURE</Science_Term>
  </Science_Parameters>
  <ISO_Topic_Category uuid="1ebf71bd-d007-42f8-8f9b-8c44a6b65a28">CLIMATOLOGY/METEOROLOGY/ATMOSPHERE</ISO_Topic_Category>
  <ISO_Topic_Category uuid="81a52fa1-4a8f-4c4d-9736-7aaf0859df9d">ENVIRONMENT</ISO_Topic_Category>
  <ISO_Topic_Category uuid="26ebb539-cae2-4961-9252-7f367642fa57">IMAGERY/BASE MAPS/EARTH COVER</ISO_Topic_Category>
  <Sensor_Name uuid="3a45d262-7ff0-4f69-8e31-48f56a7edb82">
    <Short_Name>AEM</Short_Name>
    <Long_Name>Airborne Electromagnetic Profiler</Long_Name>
  </Sensor_Name>
  <Sensor_Name uuid="a9bd961e-1063-4f37-99b6-ecd77aa9eb40">
    <Short_Name>AIRS</Short_Name>
    <Long_Name>Atmospheric Infrared Sounder</Long_Name>
  </Sensor_Name>
  <Sensor_Name uuid="30926fb0-7796-4ac1-9d8e-7cd1e4a4b7d1">
    <Short_Name>AERS</Short_Name>
    <Long_Name>Atmospheric/Emitted Radiation Sensor</Long_Name>
  </Sensor_Name>
  <Source_Name uuid="ea7fd15d-190d-43f3-bdd3-75f5d88dc3f8">
    <Short_Name>AQUA</Short_Name>
    <Long_Name>Earth Observing System, AQUA</Long_Name>
  </Source_Name>
  <Project uuid="3d1847aa-4eba-4c78-b4fc-f4223ca16539">
    <Short_Name>EOS</Short_Name>
    <Long_Name>Earth Observing System</Long_Name>
  </Project>
  <Project uuid="4dac8541-0c69-4cd5-ae70-eb8819f39715">
    <Short_Name>EOSDIS</Short_Name>
    <Long_Name>Earth Observing System Data Information System</Long_Name>
  </Project>
  <Project uuid="5f139d40-4050-4a8e-bd2b-fcae1cfe3d01">
    <Short_Name>ESIP</Short_Name>
    <Long_Name>Earth Science Information Partners Program</Long_Name>
  </Project>
  <Project uuid="c9c09e63-c018-4870-b0cd-fcc37a2539a8">
    <Short_Name>OGC/WCS</Short_Name>
    <Long_Name>Open Geospatial Consortium/Web Coverage Service</Long_Name>
  </Project>
  <Service_Language>English</Service_Language>
  <Distribution>
    <Distribution_Media>Digital</Distribution_Media>
    <Distribution_Size>&lt;=728MB per request</Distribution_Size>
    <Distribution_Format>HTTP</Distribution_Format>
    <Fees>None</Fees>
  </Distribution>
  <Service_Provider>
    <Service_Organization uuid="51a7f454-defc-47c2-ba6a-f95847962b7e">
      <Short_Name>NASA/GSFC/SED/ESD/GCDC/GESDISC</Short_Name>
      <Long_Name>Goddard Earth Sciences Data and Information Services Center (formerly Goddard DAAC), Global Change Data Center, Earth Sciences Division, Science and Exploration Directorate, Goddard Space Flight Center, NASA</Long_Name>
    </Service_Organization>
    <Service_Organization_URL>http://disc.gsfc.nasa.gov/</Service_Organization_URL>
    <Personnel>
      <Role>SERVICE PROVIDER CONTACT</Role>
      <First_Name>FIRSTNAME</First_Name>
      <Last_Name>LASTNAME</Last_Name>
      <Email>FIRSTNAME.LASTNAME@nasa.gov</Email>
      <Phone>301-555-5555</Phone>
      <Fax>301-555-5555</Fax>
      <Contact_Address>
        <Address>NASA GSFC, Code 610.2</Address>
        <City>Greenbelt</City>
        <Province_or_State>MD</Province_or_State>
        <Postal_Code>20771</Postal_Code>
        <Country>U.S.A.</Country>
      </Contact_Address>
    </Personnel>
  </Service_Provider>
  <Summary>
    <Abstract>This is one of the GES DISC's OGC Web Coverage Service (WCS) instances which provides Level 3 Gridded atmospheric data products derived from the Atmospheric Infrared Sounder (AIRS) on board NASA's Aqua spacecraft.</Abstract>
  </Summary>
  <Related_URL>
    <URL_Content_Type uuid="029540bb-7f5c-44ba-8578-61e2f858be60">
      <Type>GET SERVICE</Type>
      <Subtype>GET WEB COVERAGE SERVICE (WCS)</Subtype>
    </URL_Content_Type>
    <URL>http://acdisc.sci.gsfc.nasa.gov/daac-bin/wcsAIRSL3?Service=WCS&amp;Version=1.0.0&amp;Request=getCapabilities</URL>
    <Description>This Web Coverage Service (WCS) is one of the multiple GES DISC data service instances used to provide gridded Level 3 Atmospheric Infrared Sounder (AIRS) data products. Accessing to this URL will result in a brief description of coverages (i.e., data layers or variables), or a getCapabilities response. A client can request more detailed information about the served coverages by sending a describeCoverage request to the server. Finally, a client can request actual data using a getCoverage request. </Description>
  </Related_URL>
  <Parent_SERF>Test Parent SERF V 5</Parent_SERF>
  <IDN_Node uuid="9ae20472-ba4c-4b01-8d97-857b73fa3c95">
    <Short_Name>USA/NASA</Short_Name>
    <Long_Name>Test Node 123</Long_Name>
  </IDN_Node>
  <IDN_Node uuid="9ae20472-ba4c-4b01-8d97-857b73fa3283">
    <Short_Name>USA/CWIC</Short_Name>
    <Long_Name>Test Node 456</Long_Name>
  </IDN_Node>
  <Metadata_Name>CEOS IDN SERF</Metadata_Name>
  <Metadata_Version>VERSION 9.7.1</Metadata_Version>
  <SERF_Creation_Date>2009-12-03</SERF_Creation_Date>
  <Last_SERF_Revision_Date>2009-12-04</Last_SERF_Revision_Date>
  <Extended_Metadata>
    <Metadata>
      <Group>gov.nasa.gsfc.gcmd</Group>
      <Name>metadata.extraction_date</Name>